{
  "catalog_version": "2026.09.21.2",
  "game_version": "unknown",
  "generated_at": "2026-09-21T19:18:47Z",
  "items": [
    {
      "fact_provenance": {
        "capacity_count": {
          "from": [
            "facts.capacity"
          ],
          "kind": "derived"
        },
        "unlock_cost_normalized": {
          "from": [
            "facts.cost"
          ],
          "kind": "derived"
        },
        "warbond_id": {
          "from": [
            "facts.source"
          ],
          "kind": "derived"
        },
        "warbond_page": {
          "from": [
            "facts.source"
          ],
          "kind": "derived"
        }
      },
      "facts": {
        "capacity": "5",
        "capacity_count": 5,
        "cost": "<span class=\"Currencyicons\"><span style=\"white-space:nowrap\"><span class=\"Medalicon\">[[File:Medal.svg|link=Medal|alt=]]</span> 65</span> [[Medal]]s</span>",
        "damage": "0",
        "source": "[[Force of Law Premium Warbond#Page 3|Force of Law]] <small><span  class=\"explain \" title=\"Page 3\">P3</span></small>",
        "unlock_cost_normalized": {
          "amount": 65,
          "currency": "medals"
        },
        "warbond_id": "force_of_law",
        "warbond_page": 3,
        "weapon_category": "Throwables",
        "weapon_type": "Special"
      },
      "id": "g_109_urchin",
      "name": "G-109 Urchin",
      "planner_tags": [],
      "provenance": [
        {
          "importer_version": "1.0.0",
          "page": "G-109 Urchin",
          "retrieved_at": "2026-09-21T19:18:47Z",
          "revision_id": 134064,
          "revision_timestamp": "2026-09-05T07:02:39Z",
          "source": "helldivers_wiki",
          "source_name": "The Helldivers Wiki",
          "source_url": "https://helldivers.wiki.gg/wiki/G-109_Urchin"
        }
      ]
    },
    {
      "fact_provenance": {
        "capacity_count": {
          "from": [
            "facts.capacity"
          ],
          "kind": "derived"
        },
        "damage_types": {
          "from": [
            "facts.damage"
          ],
          "kind": "derived"
        },
        "unlock_cost_normalized": {
          "from": [
            "facts.cost"
          ],
          "kind": "derived"
        },
        "warbond_id": {
          "from": [
            "facts.source"
          ],
          "kind": "derived"
        },
        "warbond_page": {
          "from": [
            "facts.source"
          ],
          "kind": "derived"
        }
      },
      "facts": {
        "capacity": "5",
        "capacity_count": 5,
        "cost": "<span class=\"Currencyicons\"><span style=\"white-space:nowrap\"><span class=\"Medalicon\">[[File:Medal.svg|link=Medal|alt=]]</span> 25</span> [[Medal]]s</span>",
        "damage": "<span class=\"DamageIcons icon-outline\">[[File:Damage Explosion Icon.svg|20px|link=Damage|alt=Explosion]]</span>&nbsp;<span class=\"DamageIcons\" >[[Damage#Damage_Types|<span style=\"color: orange;\">300 Explosion </span>]]</span><br> <span class=\"DamageIcons icon-outline\">[[File:Damage Fire Icon.svg|20px|link=Damage|alt=Fire]]</span>&nbsp;<span class=\"DamageIcons\" >[[Damage#Damage_Types|<span style=\"color: orangered;\">100 Fire DPS </span>]]</span>",
        "damage_types": [
          "explosion",
          "fire"
        ],
        "source": "[[Steeled Veterans Premium Warbond#Page 2|Steeled Veterans]] <small><span  class=\"explain \" title=\"Page 2\">P2</span></small>",
        "unlock_cost_normalized": {
          "amount": 25,
          "currency": "medals"
        },
        "warbond_id": "steeled_veterans",
        "warbond_page": 2,
        "weapon_category": "Throwables",
        "weapon_type": "Standard"
      },
      "id": "g_10_incendiary",
      "name": "G-10 Incendiary",
      "planner_tags": [],
      "provenance": [
        {
          "importer_version": "1.0.0",
          "page": "G-10 Incendiary",
          "retrieved_at": "2026-09-21T19:18:47Z",
          "revision_id": 123870,
          "revision_timestamp": "2026-06-19T21:54:30Z",
          "source": "helldivers_wiki",
          "source_name": "The Helldivers Wiki",
          "source_url": "https://helldivers.wiki.gg/wiki/G-10_Incendiary"
        }
      ]
    },
    {
      "fact_provenance": {
        "capacity_count": {
          "from": [
            "facts.capacity"
          ],
          "kind": "derived"
        },
        "damage_types": {
          "from": [
            "facts.damage"
          ],
          "kind": "derived"
        },
        "unlock_cost_normalized": {
          "from": [
            "facts.cost"
          ],
          "kind": "derived"
        },
        "warbond_id": {
          "from": [
            "facts.source"
          ],
          "kind": "derived"
        },
        "warbond_page": {
          "from": [
            "facts.source"
          ],
          "kind": "derived"
        }
      },
      "facts": {
        "capacity": "3",
        "capacity_count": 3,
        "cost": "<span class=\"Currencyicons\"><span style=\"white-space:nowrap\"><span class=\"Medalicon\">[[File:Medal.svg|link=Medal|alt=]]</span> 15</span> [[Medal]]s</span>",
        "damage": "<span class=\"DamageIcons icon-outline\">[[File:Damage Fire Icon.svg|20px|link=Damage|alt=]]</span>&nbsp;<span class=\"DamageIcons\" >[[Damage#Damage_Types|<span style=\"color: orangered;\">150/s over 6.5s Fire</span>]]</span><br> <span class=\"DamageIcons icon-outline\">[[File:Damage Explosion Icon.svg|20px|link=Damage|alt=]]</span>&nbsp;<span class=\"DamageIcons\" >[[Damage#Damage_Types|<span style=\"color: orange;\">2000 Explosion</span>]]</span>",
        "damage_types": [
          "fire",
          "explosion"
        ],
        "source": "[[Democratic Detonation Premium Warbond#Page 1|Democratic Detonation]] <small><span  class=\"explain \" title=\"Page 1\">P1</span></small>",
        "unlock_cost_normalized": {
          "amount": 15,
          "currency": "medals"
        },
        "warbond_id": "democratic_detonation",
        "warbond_page": 1,
        "weapon_category": "Throwables",
        "weapon_type": "Special"
      },
      "id": "g_123_thermite",
      "name": "G-123 Thermite",
      "planner_tags": [],
      "provenance": [
        {
          "importer_version": "1.0.0",
          "page": "G-123 Thermite",
          "retrieved_at": "2026-09-21T19:18:47Z",
          "revision_id": 126403,
          "revision_timestamp": "2026-07-19T19:46:25Z",
          "source": "helldivers_wiki",
          "source_name": "The Helldivers Wiki",
          "source_url": "https://helldivers.wiki.gg/wiki/G-123_Thermite"
        }
      ]
    },
    {
      "fact_provenance": {
        "capacity_count": {
          "from": [
            "facts.capacity"
          ],
          "kind": "derived"
        },
        "damage_types": {
          "from": [
            "facts.damage"
          ],
          "kind": "derived"
        }
      },
      "facts": {
        "capacity": "5",
        "capacity_count": 5,
        "damage": "<span class=\"DamageIcons icon-outline\">[[File:Damage Explosion Icon.svg|20px|link=Damage|alt=]]</span>&nbsp;<span class=\"DamageIcons\" >[[Damage#Damage_Types|<span style=\"color: orange;\">800 Explosion</span>]]</span>",
        "damage_types": [
          "explosion"
        ],
        "source": "Starter Equipment",
        "weapon_category": "Throwables",
        "weapon_type": "Standard"
      },
      "id": "g_12_high_explosive",
      "name": "G-12 High Explosive",
      "planner_tags": [],
      "provenance": [
        {
          "importer_version": "1.0.0",
          "page": "G-12 High Explosive",
          "retrieved_at": "2026-09-21T19:18:47Z",
          "revision_id": 126141,
          "revision_timestamp": "2026-07-17T21:07:14Z",
          "source": "helldivers_wiki",
          "source_name": "The Helldivers Wiki",
          "source_url": "https://helldivers.wiki.gg/wiki/G-12_High_Explosive"
        }
      ]
    },
    {
      "fact_provenance": {
        "capacity_count": {
          "from": [
            "facts.capacity"
          ],
          "kind": "derived"
        },
        "damage_types": {
          "from": [
            "facts.damage"
          ],
          "kind": "derived"
        },
        "unlock_cost_normalized": {
          "from": [
            "facts.cost"
          ],
          "kind": "derived"
        },
        "warbond_id": {
          "from": [
            "facts.source"
          ],
          "kind": "derived"
        },
        "warbond_page": {
          "from": [
            "facts.source"
          ],
          "kind": "derived"
        }
      },
      "facts": {
        "capacity": "5",
        "capacity_count": 5,
        "cost": "<span class=\"Currencyicons\"><span style=\"white-space:nowrap\"><span class=\"Medalicon\">[[File:Medal.svg|link=Medal|alt=]]</span> 25</span> [[Medal]]s</span>",
        "damage": "<span class=\"DamageIcons icon-outline\">[[File:Damage Explosion Icon.svg|20px|link=Damage|alt=Explosion]]</span>&nbsp;<span class=\"DamageIcons\" >[[Damage#Damage_Types|<span style=\"color: orange;\">150 Explosion </span>]]</span><br><span class=\"DamageIcons icon-outline\">[[File:Damage Fire Icon.svg|20px|link=Damage|alt=Fire]]</span>&nbsp;<span class=\"DamageIcons\" >[[Damage#Damage_Types|<span style=\"color: orangered;\">100 Fire DPS </span>]]</span>",
        "damage_types": [
          "explosion",
          "fire"
        ],
        "source": "[[Polar Patriots Premium Warbond#Page 2|Polar Patriots]] <small><span  class=\"explain \" title=\"Page 2\">P2</span></small>",
        "unlock_cost_normalized": {
          "amount": 25,
          "currency": "medals"
        },
        "warbond_id": "polar_patriots",
        "warbond_page": 2,
        "weapon_category": "Throwables",
        "weapon_type": "Special"
      },
      "id": "g_13_incendiary_impact",
      "name": "G-13 Incendiary Impact",
      "planner_tags": [],